{"version":"1.0","type":"drawing","coordinate_space":"normalized_screen","canvas":{"aspect_ratio":1.5},"device":{"pointer_type":"pen","pressure_observed":true},"source":{"type":"synthetic_fixture"},"strokes":[{"points":[{"x":0.5,"y":0.09999999999999998,"t_ms":0.0,"pressure":0.5,"pointer_type":"pen","tilt_x":0,"tilt_y":0,"twist":0},{"x":0.5014694631307312,"y":0.10476057103782879,"t_ms":12.0,"pressure":0.51749,"pointer_type":"pen","tilt_x":0,"tilt_y":0,"twist":0},{"x":0.5029389262614624,"y":0.1095211420756576,"t_ms":24.0,"pressure":0.53489,"pointer_type":"pen","tilt_x":0,"tilt_y":0,"twist":0},{"x":0.5044083893921936,"y":0.11428171311348641,"t_ms":36.0,"pressure":0.55211,"pointer_type":"pen","tilt_x":0,"tilt_y":0,"twist":0},{"x":0.5058778525229247,"y":0.11904228415131521,"t_ms":48.0,"pressure":0.56909,"pointer_type":"pen","tilt_x":0,"tilt_y":0,"twist":0},{"x":0.5073473156536559,"y":0.12380285518914402,"t_ms":60.0,"pressure":0.58572,"pointer_type":"pen","tilt_x":0,"tilt_y":0,"twist":0},{"x":0.5088167787843871,"y":0.12856342622697284,"t_ms":72.0,"pressure":0.60194,"pointer_type":"pen","tilt_x":0,"tilt_y":0,"twist":0},{"x":0.5102862419151183,"y":0.13332399726480165,"t_ms":84.0,"pressure":0.61766,"pointer_type":"pen","tilt_x":0,"tilt_y":0,"twist":0},{"x":0.5117557050458494,"y":0.13808456830263044,"t_ms":96.0,"pressure":0.6328,"pointer_type":"pen","tilt_x":0,"tilt_y":0,"twist":0},{"x":0.5132251681765806,"y":0.14284513934045925,"t_ms":108.0,"pressure":0.64729,"pointer_type":"pen","tilt_x":0,"tilt_y":0,"twist":0},{"x":0.5146946313073119,"y":0.14760571037828807,"t_ms":120.0,"pressure":0.66105,"pointer_type":"pen","tilt_x":0,"tilt_y":0,"twist":0},{"x":0.516164094438043,"y":0.15236628141611688,"t_ms":132.0,"pressure":0.67403,"pointer_type":"pen","tilt_x":0,"tilt_y":0,"twist":0},{"x":0.5176335575687742,"y":0.1571268524539457,"t_ms":144.0,"pressure":0.68616,"pointer_type":"pen","tilt_x":0,"tilt_y":0,"twist":0},{"x":0.5191030206995054,"y":0.1618874234917745,"t_ms":156.0,"pressure":0.69738,"pointer_type":"pen","tilt_x":0,"tilt_y":0,"twist":0},{"x":0.5205724838302366,"y":0.16664799452960333,"t_ms":168.0,"pressure":0.70762,"pointer_type":"pen","tilt_x":0,"tilt_y":0,"twist":0},{"x":0.5220419469609677,"y":0.17140856556743211,"t_ms":180.0,"pressure":0.71686,"pointer_type":"pen","tilt_x":0,"tilt_y":0,"twist":0},{"x":0.5235114100916989,"y":0.17616913660526093,"t_ms":192.0,"pressure":0.72503,"pointer_type":"pen","tilt_x":0,"tilt_y":0,"twist":0},{"x":0.5249808732224301,"y":0.18092970764308974,"t_ms":204.0,"pressure":0.73209,"pointer_type":"pen","tilt_x":0,"tilt_y":0,"twist":0},{"x":0.5264503363531613,"y":0.18569027868091853,"t_ms":216.0,"pressure":0.73802,"pointer_type":"pen","tilt_x":0,"tilt_y":0,"twist":0},{"x":0.5279197994838924,"y":0.19045084971874737,"t_ms":228.0,"pressure":0.74279,"pointer_type":"pen","tilt_x":0,"tilt_y":0,"twist":0},{"x":0.5293892626146237,"y":0.19521142075657616,"t_ms":240.0,"pressure":0.74636,"pointer_type":"pen","tilt_x":0,"tilt_y":0,"twist":0},{"x":0.5308587257453549,"y":0.199971991794405,"t_ms":252.0,"pressure":0.74873,"pointer_type":"pen","tilt_x":0,"tilt_y":0,"twist":0},{"x":0.532328188876086,"y":0.2047325628322338,"t_ms":264.0,"pressure":0.74988,"pointer_type":"pen","tilt_x":0,"tilt_y":0,"twist":0},{"x":0.5337976520068172,"y":0.20949313387006258,"t_ms":276.0,"pressure":0.74981,"pointer_type":"pen","tilt_x":0,"tilt_y":0,"twist":0},{"x":0.5352671151375484,"y":0.21425370490789142,"t_ms":288.0,"pressure":0.74851,"pointer_type":"pen","tilt_x":0,"tilt_y":0,"twist":0},{"x":0.5367365782682796,"y":0.2190142759457202,"t_ms":300.0,"pressure":0.746,"pointer_type":"pen","tilt_x":0,"tilt_y":0,"twist":0},{"x":0.5382060413990107,"y":0.22377484698354905,"t_ms":312.0,"pressure":0.74228,"pointer_type":"pen","tilt_x":0,"tilt_y":0,"twist":0},{"x":0.5396755045297419,"y":0.22853541802137783,"t_ms":324.0,"pressure":0.73737,"pointer_type":"pen","tilt_x":0,"tilt_y":0,"twist":0},{"x":0.5411449676604732,"y":0.23329598905920665,"t_ms":336.0,"pressure":0.7313,"pointer_type":"pen","tilt_x":0,"tilt_y":0,"twist":0},{"x":0.5426144307912043,"y":0.23805656009703546,"t_ms":348.0,"pressure":0.7241,"pointer_type":"pen","tilt_x":0,"tilt_y":0,"twist":0},{"x":0.5440838939219355,"y":0.24281713113486428,"t_ms":360.0,"pressure":0.7158,"pointer_type":"pen","tilt_x":0,"tilt_y":0,"twist":0},{"x":0.5455533570526667,"y":0.24757770217269306,"t_ms":372.0,"pressure":0.70645,"pointer_type":"pen","tilt_x":0,"tilt_y":0,"twist":0},{"x":0.5470228201833979,"y":0.2523382732105219,"t_ms":384.0,"pressure":0.69608,"pointer_type":"pen","tilt_x":0,"tilt_y":0,"twist":0},{"x":0.548492283314129,"y":0.2570988442483507,"t_ms":396.0,"pressure":0.68475,"pointer_type":"pen","tilt_x":0,"tilt_y":0,"twist":0},{"x":0.5499617464448602,"y":0.2618594152861795,"t_ms":408.0,"pressure":0.67252,"pointer_type":"pen","tilt_x":0,"tilt_y":0,"twist":0},{"x":0.5514312095755914,"y":0.2666199863240083,"t_ms":420.0,"pressure":0.65944,"pointer_type":"pen","tilt_x":0,"tilt_y":0,"twist":0},{"x":0.5529006727063226,"y":0.2713805573618371,"t_ms":432.0,"pressure":0.64558,"pointer_type":"pen","tilt_x":0,"tilt_y":0,"twist":0},{"x":0.5543701358370537,"y":0.2761411283996659,"t_ms":444.0,"pressure":0.63101,"pointer_type":"pen","tilt_x":0,"tilt_y":0,"twist":0},{"x":0.5558395989677849,"y":0.28090169943749477,"t_ms":456.0,"pressure":0.6158,"pointer_type":"pen","tilt_x":0,"tilt_y":0,"twist":0},{"x":0.5573090620985162,"y":0.28566227047532355,"t_ms":468.0,"pressure":0.60002,"pointer_type":"pen","tilt_x":0,"tilt_y":0,"twist":0},{"x":0.5587785252292473,"y":0.29042284151315234,"t_ms":480.0,"pressure":0.58375,"pointer_type":"pen","tilt_x":0,"tilt_y":0,"twist":0},{"x":0.5602479883599785,"y":0.2951834125509812,"t_ms":492.0,"pressure":0.56707,"pointer_type":"pen","tilt_x":0,"tilt_y":0,"twist":0},{"x":0.5617174514907097,"y":0.29994398358881,"t_ms":504.0,"pressure":0.55006,"pointer_type":"pen","tilt_x":0,"tilt_y":0,"twist":0},{"x":0.5631869146214409,"y":0.3047045546266388,"t_ms":516.0,"pressure":0.5328,"pointer_type":"pen","tilt_x":0,"tilt_y":0,"twist":0},{"x":0.564656377752172,"y":0.3094651256644676,"t_ms":528.0,"pressure":0.51539,"pointer_type":"pen","tilt_x":0,"tilt_y":0,"twist":0},{"x":0.5661258408829032,"y":0.3142256967022964,"t_ms":540.0,"pressure":0.4979,"pointer_type":"pen","tilt_x":0,"tilt_y":0,"twist":0},{"x":0.5675953040136344,"y":0.3189862677401252,"t_ms":552.0,"pressure":0.48042,"pointer_type":"pen","tilt_x":0,"tilt_y":0,"twist":0},{"x":0.5690647671443656,"y":0.32374683877795407,"t_ms":564.0,"pressure":0.46303,"pointer_type":"pen","tilt_x":0,"tilt_y":0,"twist":0},{"x":0.5705342302750968,"y":0.32850740981578286,"t_ms":576.0,"pressure":0.44583,"pointer_type":"pen","tilt_x":0,"tilt_y":0,"twist":0},{"x":0.5720036934058279,"y":0.33326798085361165,"t_ms":588.0,"pressure":0.42889,"pointer_type":"pen","tilt_x":0,"tilt_y":0,"twist":0},{"x":0.5734731565365592,"y":0.33802855189144043,"t_ms":600.0,"pressure":0.4123,"pointer_type":"pen","tilt_x":0,"tilt_y":0,"twist":0},{"x":0.5749426196672903,"y":0.3427891229292692,"t_ms":612.0,"pressure":0.39614,"pointer_type":"pen","tilt_x":0,"tilt_y":0,"twist":0},{"x":0.5764120827980215,"y":0.3475496939670981,"t_ms":624.0,"pressure":0.38049,"pointer_type":"pen","tilt_x":0,"tilt_y":0,"twist":0},{"x":0.5778815459287527,"y":0.35231026500492685,"t_ms":636.0,"pressure":0.36543,"pointer_type":"pen","tilt_x":0,"tilt_y":0,"twist":0},{"x":0.5793510090594839,"y":0.3570708360427557,"t_ms":648.0,"pressure":0.35102,"pointer_type":"pen","tilt_x":0,"tilt_y":0,"twist":0},{"x":0.580820472190215,"y":0.36183140708058453,"t_ms":660.0,"pressure":0.33734,"pointer_type":"pen","tilt_x":0,"tilt_y":0,"twist":0},{"x":0.5822899353209462,"y":0.3665919781184133,"t_ms":672.0,"pressure":0.32446,"pointer_type":"pen","tilt_x":0,"tilt_y":0,"twist":0},{"x":0.5837593984516775,"y":0.3713525491562421,"t_ms":684.0,"pressure":0.31244,"pointer_type":"pen","tilt_x":0,"tilt_y":0,"twist":0},{"x":0.5852288615824086,"y":0.37611312019407095,"t_ms":696.0,"pressure":0.30134,"pointer_type":"pen","tilt_x":0,"tilt_y":0,"twist":0},{"x":0.5866983247131398,"y":0.38087369123189974,"t_ms":708.0,"pressure":0.29121,"pointer_type":"pen","tilt_x":0,"tilt_y":0,"twist":0},{"x":0.588167787843871,"y":0.3856342622697286,"t_ms":720.0,"pressure":0.28211,"pointer_type":"pen","tilt_x":0,"tilt_y":0,"twist":0},{"x":0.5896372509746022,"y":0.39039483330755737,"t_ms":732.0,"pressure":0.27407,"pointer_type":"pen","tilt_x":0,"tilt_y":0,"twist":0},{"x":0.5911067141053333,"y":0.39515540434538615,"t_ms":744.0,"pressure":0.26713,"pointer_type":"pen","tilt_x":0,"tilt_y":0,"twist":0},{"x":0.5925761772360645,"y":0.399915975383215,"t_ms":756.0,"pressure":0.26134,"pointer_type":"pen","tilt_x":0,"tilt_y":0,"twist":0},{"x":0.5940456403667957,"y":0.4046765464210438,"t_ms":768.0,"pressure":0.25672,"pointer_type":"pen","tilt_x":0,"tilt_y":0,"twist":0},{"x":0.5955151034975269,"y":0.40943711745887257,"t_ms":780.0,"pressure":0.25329,"pointer_type":"pen","tilt_x":0,"tilt_y":0,"twist":0},{"x":0.596984566628258,"y":0.4141976884967014,"t_ms":792.0,"pressure":0.25107,"pointer_type":"pen","tilt_x":0,"tilt_y":0,"twist":0},{"x":0.5984540297589893,"y":0.4189582595345302,"t_ms":804.0,"pressure":0.25006,"pointer_type":"pen","tilt_x":0,"tilt_y":0,"twist":0},{"x":0.5999234928897205,"y":0.42371883057235904,"t_ms":816.0,"pressure":0.25028,"pointer_type":"pen","tilt_x":0,"tilt_y":0,"twist":0},{"x":0.6013929560204516,"y":0.4284794016101878,"t_ms":828.0,"pressure":0.25173,"pointer_type":"pen","tilt_x":0,"tilt_y":0,"twist":0},{"x":0.6028624191511828,"y":0.4332399726480166,"t_ms":840.0,"pressure":0.25439,"pointer_type":"pen","tilt_x":0,"tilt_y":0,"twist":0},{"x":0.604331882281914,"y":0.43800054368584546,"t_ms":852.0,"pressure":0.25825,"pointer_type":"pen","tilt_x":0,"tilt_y":0,"twist":0},{"x":0.6058013454126452,"y":0.44276111472367424,"t_ms":864.0,"pressure":0.2633,"pointer_type":"pen","tilt_x":0,"tilt_y":0,"twist":0},{"x":0.6072708085433763,"y":0.4475216857615031,"t_ms":876.0,"pressure":0.2695,"p